{
  "version": 1,
  "git_hash": "fe4a4029a080bc955e9588d05a6cd9eb490845d4",
  "results": [
    {
      "key": {
        "test": "memory_usage_0_0",
        "sub_result": "max_rss_mb"
      },
      "measurements": {
        "sub_result": [
          {
            "value": "max_rss_mb",
            "measurement": 858
          }
        ]
      }
    }
  ],
  "key": {
    "branch": "ignoreme"
  }
}
